84.00,1284人付款,上海,INCAKE至爱红丝绒生日蛋糕水果奶油同城
38.20,37184人付款,广东 揭阳,港荣蒸蛋糕点 整箱1kg点心早餐零食品批发美食小吃手撕全麦面包邮
32.00,40857人付款,黑龙江 牡丹江,俄之恋提拉米苏蛋糕千层夹心手工点心早餐俄式风味西式糕点320g克
198.00,3人付款,广东 广州,高档双层蓝色款粉色冰雪奇缘场景爱莎生日蛋糕全国配送同城速递
188.00,6人付款,辽宁 大连,大连同城配送个性创意可爱百天周岁纯动物奶油女宝宝生日蛋糕
88.00,0人付款,湖南 长沙,四川省 达州市 达  县 宣汉县 开江县生日蛋糕派送 速递 同城配送
168.00,0人付款,福建 厦门,NO.352 芙拉维亚马卡龙巧克力蛋糕 厦门生日蛋糕 进口动物奶油
51.00,0人付款,山东 临沂,儿童卡通生肖可爱喜羊羊生日蛋糕临沂定制配送同城速递六一儿童节
198.00,0人付款,吉林 长春,双层长春生日蛋糕订制快递配送/蛋糕店实图/同城外卖/0302
98.00,0人付款,吉林 长春,长春生日蛋糕/巧克力生日蛋糕/cake/同城外卖配送/蛋糕店实图0015
80.00,0人付款,吉林 长春,长春蛋糕定制/生日蛋糕快递派送/圆型蛋糕速递/实拍、0231
98.00,0人付款,吉林 长春,长春蛋糕速递/巧克力脆皮蛋糕/长春蛋糕/同城外卖/实图/0126
78.00,0人付款,湖南 郴州,郴州市北湖区苏仙区桂阳县宜章县永兴县情侣生日蛋糕同城配送速递
52.30,40人付款,江苏 南京,泓一Q点巧克力涂饰蛋糕2000g 夹心软蛋糕 4味可选整箱批 发包邮
8.00,1人付款,北京,北京米奇纸杯蛋糕婚礼蛋糕 Cup Cake杯子蛋糕 甜品15701653225
18.00,2人付款,四川 成都,法式焦糖奶油杯子纸杯蛋糕生日蛋糕儿童婚庆新鲜烘焙同城配送
78.00,0人付款,吉林 松原,同城送货松原市白山市水果蛋糕长岭县蛋糕辽源市实体店
198.00,0人付款,广东 广州,彩虹蛋糕
188.00,22人付款,广东 广州,广州佛山市定制儿童周岁百天卡通女孩布朗熊双层生日蛋糕同城配送
6.80,1人付款,辽宁 锦州,新品上市  200克回头客枣泥蛋糕 礼袋装早餐糕点零食点心
88.00,0人付款,辽宁 本溪,同城送货本溪市锦州市水果蛋糕大连市芭比公主儿童生日蛋糕丹东市
109.00,0人付款,上海,新鲜生日蛋糕同城速递上海浦东高行高东张江三林惠南镇周浦镇配送
258.00,1人付款,北京,布朗熊生日蛋糕LINE可妮兔巧克力淋面新鲜定制 深圳北京同城配送
130.00,0人付款,福建 福州,向阳坊蛋糕厦门生日蛋糕厦门专款生日蛋糕儿童生日蛋糕|足球6寸
138.00,0人付款,山东 淄博,生日蛋糕周村区桓台县高青县沂源县同城实体蛋糕店送全国
188.00,0人付款,浙江 杭州,喵女王巧克力浆果蛋糕草莓蛋糕裸蛋糕生日蛋糕茶歇甜品台
27.90,3人付款,北京,康师傅妙芙阳光早餐蛋糕牛奶谷物味盒装96gx5糕点零食营养小面包
730.00,1人付款,广东 广州,【Yuki Cake Time】爱心皇冠 花环 女生女神生日 表白 翻糖蛋糕
9.50,1人付款,辽宁 锦州,满68元包邮 新品375克回头客枣泥蛋糕礼袋装零食点心办公室零食
88.00,0人付款,江苏 南京,生日蛋糕全国同城配送南京市玄武区鼓楼区建邺区白下区秦淮雨花台
17.80,2人付款,辽宁 沈阳,临期俄罗斯进口零食法式奶酪迷你小蛋糕提拉米苏味早餐700克包邮
398.00,0人付款,山东 潍坊,韩式裱花蛋糕 可定制 生日蛋糕 创意可来图定制  同城配送  花束
73.00,0人付款,辽宁 朝阳,同城送货朝阳市铁岭市水果蛋糕建平县麻将蛋糕盘锦市实体店
98.00,0人付款,上海,生日蛋糕 樱桃 小丸子蛋糕 创意蛋糕 卡通蛋糕 宝宝生日女友生日
178.80,1人付款,内蒙古 呼伦贝尔,人气热销俄罗斯双山提拉米苏6寸500克包邮正品礼盒精装蛋糕糕点
88.00,0人付款,湖南 长沙,四川省 宜宾市 长宁县 屏山县 兴文县 生日蛋糕 速递 同城派送
168.00,0人付款,云南 昆明,昆明鳳姐蛋糕  小鸭子蛋糕   高尔夫球一杆进洞蛋糕
17.60,0人付款,上海,静安面包房面包券 20型面包蛋糕优惠券提货券现金券 上海通用
350.00,0人付款,广东 广州,【Yuki Cake Time】Hello Kitty金色星星广州定制翻糖蛋糕配送
118.00,5人付款,湖南 长沙,全国各省市区县部分乡镇村巧克力创意水果生日蛋糕店同城免费配送
123.00,0人付款,广东 广州,森系淡雅生日蛋糕 柔滑动奶油水果鲜花裸蛋糕 可叠多层 广州
108.00,15人付款,内蒙古 呼伦贝尔,俄罗斯正宗双山千层提拉米苏奶油蛋糕新鲜礼盒整箱买5发6块送威化
17.50,9人付款,广西 南宁,马来西亚进口休闲食品 福多蛋糕FUDO 24包入蛋糕432g 糕点四口味
128.00,0人付款,北京,个性手工鲜奶油水果生日蛋糕定制颜色渐变 北京蛋糕店免费送货
798.00,0人付款,北京,棒棒糖 翻糖蛋糕定制 篮球主题蛋糕 北京生日蛋糕 宴会主题
128.00,0人付款,河南 郑州,生日蛋糕，安阳蛋糕店，南阳蛋糕店，平顶山蛋糕店，同城送到家！
198.00,0人付款,四川 成都,双层生日蛋糕，成都/宜宾/乐山/德阳市蛋糕店，同城蛋糕送到家！
158.00,0人付款,黑龙江 哈尔滨,哈尔滨蛋糕店，香坊区/龙江县蛋糕，澳洲牛乳蛋糕，同城送到家！
188.00,0人付款,广东 深圳,榴莲千层蛋糕，芒果千层蛋糕，千层蛋糕，珠海蛋糕，市内送到家！
128.00,0人付款,山西 太原,太原市蛋糕，大同市蛋糕/阳泉市蛋糕/生日蛋糕！同城蛋糕送到家！
138.00,0人付款,山西 太原,芭比娃娃生日蛋糕，武汉/长沙/成都/郑州蛋糕，新鲜蛋糕送到家！
268.00,1人付款,山西 太原,双层芭比娃娃蛋糕，太原/合肥/哈尔滨/沈阳/郑州蛋糕，市内送到家
128.00,0人付款,河南 郑州,全国生日蛋糕店，齐齐哈尔/哈尔滨//扬州/兰州蛋糕，蛋糕送到家！
198.00,0人付款,安徽 合肥,全国皇冠蛋糕合肥/淮南/银川/太原/南京苏州蛋糕店，同城送到家！
138.00,0人付款,上海,芭比娃娃生日蛋糕，秦皇岛/平顶山/张家界蛋糕，全国市内送到家！
3.80,1人付款,上海,上海来伊份官方旗舰店原味树轮蛋糕1个原味江浙沪皖满包邮来一份
138.00,0人付款,安徽 合肥,芭比娃娃生日蛋糕，哈尔滨/七台河/沈阳/大连蛋糕，同城送到家！
178.00,0人付款,上海,天得利cake创意定制送闺蜜女朋友皇冠礼物生日蛋糕上海市配送包邮
145.00,0人付款,浙江 嘉兴,【最新日期】日本北海道DOLEC VITA咖啡兔二世古吟酿鲍姆年轮蛋糕
188.00,0人付款,浙江 台州,台州LITTLE SUGAR高级定制创意水果奶油生日蛋糕同城配送
88.00,0人付款,山西 晋中,同城送货晋中市灵石县水果蛋糕寿阳县新鲜水果生日蛋糕平遥县实体
198.00,0人付款,福建 厦门,福州厦门泉州漳州85度c 生日蛋糕 配送货上门速递同城 暖日香颂
198.00,0人付款,陕西 西安,西安翻糖蛋糕女宝宝周岁满月百天蛋糕动物奶油生日蛋糕同城速递
128.00,0人付款,安徽 合肥,数码蛋糕全国同城配送合肥庐阳区瑶海区蜀山区包河区芜湖市镜湖区
88.00,3人付款,北京,卡通海绵宝宝创意蛋糕 儿童生日蛋糕同城北京同城配送朝阳丰台
88.00,0人付款,湖南 长沙,河北省 邯郸市 峰峰矿区武安市邯郸县生日蛋糕派送 速递 同城配送
158.00,0人付款,福建 泉州,福州蛋糕同城长乐平潭福清闽侯马尾泉州石狮晋江包邮配送深圳北京
30.00,14人付款,黑龙江 牡丹江,包邮俄罗斯提拉米苏蛋糕6寸500克*5个整箱包邮松软新鲜正品早餐
78.00,0人付款,河南 新乡,同城送货新乡市封丘县水果蛋糕新乡县水果生日蛋糕延津县实体店
118.00,0人付款,安徽 合肥,丰收田园】生日蛋糕合肥同城配送 水果蛋糕合肥店 蛋糕合肥速递
350.00,0人付款,广东 深圳,来图定制宝宝周岁翻糖蛋糕 草莓水果生日蛋糕深圳广州同城配送
118.00,0人付款,山西 晋中,晋中市榆次区榆社县左权县昔阳县寿阳县水果生日蛋糕店同城配送
18.00,1人付款,广东 惠州,马来西亚零食品Lonbisco伦敦卷480g草莓味夹心 瑞士卷蛋糕零食品
138.00,0人付款,河北 石家庄,小猪佩奇卡通生日蛋糕配送石家庄武汉天津北京西安深圳 同城速递
15.00,0人付款,山东 青岛,蕾娜斯翻糖订制/棒棒糖蛋糕/飘雪/青岛个性蛋糕/创意回礼蛋糕
168.00,0人付款,四川 成都,沁园/芒果慕斯/芒果口味生日蛋糕/限成都订购/门店自取
78.00,0人付款,河北 承德,同城送货承德市平泉县水果蛋糕隆化县水果生日蛋糕兴隆县实体店
63.90,0人付款,北京,河北稻香村老面包310g*10袋 早餐面包糕点点心软面包蛋糕
7.90,25人付款,黑龙江 牡丹江,俄罗斯进口提拉米苏蛋糕6寸500克全店满35元包邮早餐蛋糕新鲜正宗
148.00,0人付款,江苏 南京,定制生日蛋糕乳山市荣成市临沂市蛋糕店
